{
  "schema_version": "v1",
  "packet_id": "scientific-follow-up-owner-signoff-f4aa48603929",
  "overallSignoffStatus": "open",
  "reviewerId": "runtime.owner",
  "reviewerRole": "scientific_reviewer",
  "overallStatus": "review_required",
  "targetProfile": {
    "profileId": "mercury_internal_review",
    "displayName": "Mercury internal review",
    "jurisdiction": "eu",
    "intendedUse": "Internal scientific review of mercury food-contaminant evidence with explicit methylmercury and inorganic-mercury dietary provenance.",
    "notes": [
      "This profile supports review-oriented mercury source lookup and documentation without implying a native mercury submission engine."
    ]
  },
  "sourceRemediationPacketId": "scientific-follow-up-remediation-c837d79aaf7a",
  "sourceHandoffPacketId": "scientific-follow-up-owner-ac45550b01b4",
  "sourceBoardId": "scientific-follow-up-board-7069e0a1f698",
  "sourceBundleId": "scientific-follow-up-85b1fc2b7c69",
  "sourceDossierId": "contaminant-monitoring-review-dossier-5383b8273189",
  "sourceDossierStatus": "open",
  "sourceWorkflow": "contaminant_monitoring_review_dossier",
  "bundleProfile": "internal_review",
  "ownerLane": "scientific_reviewer",
  "legalLimitReviews": [
    {
      "contaminantFamily": "mercury_food_contaminants",
      "jurisdiction": "eu",
      "substanceKey": null,
      "commodityCode": null,
      "matrixGroup": "broad_food_supply",
      "authority": null,
      "requestedLaneStatus": "no_curated_family_coverage",
      "curatedScopeCommodityCodes": [],
      "curatedScopeMatrixGroups": [],
      "legalAuthorities": [],
      "matchedRecords": [],
      "coverageSummaries": [],
      "overallSubmissionUse": "review_required",
      "qualityFlags": [
        {
          "code": "coverage_gap",
          "severity": "warning",
          "message": "No governed contaminant legal-limit coverage is currently curated for family `mercury_food_contaminants` in jurisdiction `eu`."
        },
        {
          "code": "no_jurisdiction_specific_legal_limit",
          "severity": "warning",
          "message": "No jurisdiction-specific contaminant legal limit matched the requested lane for `eu`."
        },
        {
          "code": "no_curated_legal_limit_for_requested_lane",
          "severity": "warning",
          "message": "No curated contaminant legal-limit record matched matrix `broad_food_supply` in `eu`."
        }
      ],
      "notes": [
        "No governed contaminant legal-limit records matched the requested filters.",
        "Jurisdiction-specific contaminant legal-limit gaps are surfaced explicitly instead of borrowing values from another authority or matrix."
      ]
    },
    {
      "contaminantFamily": "mercury_food_contaminants",
      "jurisdiction": "eu",
      "substanceKey": null,
      "commodityCode": null,
      "matrixGroup": "fish_and_seafood",
      "authority": null,
      "requestedLaneStatus": "no_curated_family_coverage",
      "curatedScopeCommodityCodes": [],
      "curatedScopeMatrixGroups": [],
      "legalAuthorities": [],
      "matchedRecords": [],
      "coverageSummaries": [],
      "overallSubmissionUse": "review_required",
      "qualityFlags": [
        {
          "code": "coverage_gap",
          "severity": "warning",
          "message": "No governed contaminant legal-limit coverage is currently curated for family `mercury_food_contaminants` in jurisdiction `eu`."
        },
        {
          "code": "no_jurisdiction_specific_legal_limit",
          "severity": "warning",
          "message": "No jurisdiction-specific contaminant legal limit matched the requested lane for `eu`."
        },
        {
          "code": "no_curated_legal_limit_for_requested_lane",
          "severity": "warning",
          "message": "No curated contaminant legal-limit record matched matrix `fish_and_seafood` in `eu`."
        }
      ],
      "notes": [
        "No governed contaminant legal-limit records matched the requested filters.",
        "Jurisdiction-specific contaminant legal-limit gaps are surfaced explicitly instead of borrowing values from another authority or matrix."
      ]
    },
    {
      "contaminantFamily": "mercury_food_contaminants",
      "jurisdiction": "eu",
      "substanceKey": null,
      "commodityCode": null,
      "matrixGroup": "large_predatory_fish",
      "authority": null,
      "requestedLaneStatus": "no_curated_family_coverage",
      "curatedScopeCommodityCodes": [],
      "curatedScopeMatrixGroups": [],
      "legalAuthorities": [],
      "matchedRecords": [],
      "coverageSummaries": [],
      "overallSubmissionUse": "review_required",
      "qualityFlags": [
        {
          "code": "coverage_gap",
          "severity": "warning",
          "message": "No governed contaminant legal-limit coverage is currently curated for family `mercury_food_contaminants` in jurisdiction `eu`."
        },
        {
          "code": "no_jurisdiction_specific_legal_limit",
          "severity": "warning",
          "message": "No jurisdiction-specific contaminant legal limit matched the requested lane for `eu`."
        },
        {
          "code": "no_curated_legal_limit_for_requested_lane",
          "severity": "warning",
          "message": "No curated contaminant legal-limit record matched matrix `large_predatory_fish` in `eu`."
        }
      ],
      "notes": [
        "No governed contaminant legal-limit records matched the requested filters.",
        "Jurisdiction-specific contaminant legal-limit gaps are surfaced explicitly instead of borrowing values from another authority or matrix."
      ]
    }
  ],
  "dueStateFilter": [],
  "actionItems": [
    {
      "actionId": "review_scientific_ledger.row_level_lod_coverage",
      "category": "scientific_ledger_data_gap",
      "title": "Review analytical measurement ledger entry",
      "priority": "review_required",
      "blocking": false,
      "summary": "Row-level LOD coverage is incomplete. Keep the governed scientific ledger rationale explicit in reviewer signoff.",
      "linkedRecordIds": [
        "row_level_lod_coverage",
        "eu.mercury.analytical_method_evidence.official_control"
      ],
      "dueState": "current_cycle",
      "remediationClass": "review_this_cycle",
      "recommendedSteps": [
        "Review linked records and supporting URIs during the current review cycle.",
        "Document reviewer rationale or completion status on the underlying scientific action.",
        "Refresh readiness-side artifacts after reviewer action is recorded."
      ],
      "decisionStatus": "pending",
      "rationale": null,
      "reviewedAt": null,
      "supportingUris": [],
      "resolved": false
    },
    {
      "actionId": "review_scientific_ledger.lower_bound_handling.eu.mercury.occurrence_evidence.official_monitoring_context",
      "category": "scientific_ledger_assumption",
      "title": "Review occurrence data ledger entry",
      "priority": "review_required",
      "blocking": false,
      "summary": "Lower-bound handling is governed by linked occurrence evidence. Keep the governed scientific ledger rationale explicit in reviewer signoff.",
      "linkedRecordIds": [
        "lower_bound_handling.eu.mercury.occurrence_evidence.official_monitoring_context",
        "eu.mercury.occurrence_evidence.official_monitoring_context"
      ],
      "dueState": "current_cycle",
      "remediationClass": "review_this_cycle",
      "recommendedSteps": [
        "Review linked records and supporting URIs during the current review cycle.",
        "Document reviewer rationale or completion status on the underlying scientific action.",
        "Refresh readiness-side artifacts after reviewer action is recorded."
      ],
      "decisionStatus": "pending",
      "rationale": null,
      "reviewedAt": null,
      "supportingUris": [],
      "resolved": false
    },
    {
      "actionId": "review_scientific_ledger.storage_stability.eu.mercury.analytical_method_evidence.official_control",
      "category": "scientific_ledger_uncertainty",
      "title": "Review analytical method ledger entry",
      "priority": "review_required",
      "blocking": false,
      "summary": "Storage-stability interpretation relies on governed analytical-method context. Keep the governed scientific ledger rationale explicit in reviewer signoff.",
      "linkedRecordIds": [
        "storage_stability.eu.mercury.analytical_method_evidence.official_control",
        "eu.mercury.analytical_method_evidence.official_control"
      ],
      "dueState": "current_cycle",
      "remediationClass": "review_this_cycle",
      "recommendedSteps": [
        "Review linked records and supporting URIs during the current review cycle.",
        "Document reviewer rationale or completion status on the underlying scientific action.",
        "Refresh readiness-side artifacts after reviewer action is recorded."
      ],
      "decisionStatus": "pending",
      "rationale": null,
      "reviewedAt": null,
      "supportingUris": [],
      "resolved": false
    },
    {
      "actionId": "review_scientific_ledger.sampling_plan.eu.mercury.analytical_method_evidence.official_control",
      "category": "scientific_ledger_assumption",
      "title": "Review sampling context ledger entry",
      "priority": "review_required",
      "blocking": false,
      "summary": "Sampling-plan interpretation relies on governed analytical-method context. Keep the governed scientific ledger rationale explicit in reviewer signoff.",
      "linkedRecordIds": [
        "sampling_plan.eu.mercury.analytical_method_evidence.official_control",
        "eu.mercury.analytical_method_evidence.official_control"
      ],
      "dueState": "current_cycle",
      "remediationClass": "review_this_cycle",
      "recommendedSteps": [
        "Review linked records and supporting URIs during the current review cycle.",